{"currency":"CZK","fees":[],"hooks":{"onOpen":[{"action":{"cadence":"DAILY","hook":"scheduled","tag":"ACCRUAL","type":"SCHEDULE"},"ruleId":"open.schedule-accrual"},{"action":{"cadence":"MONTHLY","hook":"scheduled","tag":"CAPITALISATION","type":"SCHEDULE"},"ruleId":"open.schedule-capitalisation"}],"scheduled":[{"action":{"type":"ACCRUE_INTEREST"},"ruleId":"scheduled.accrue","trigger":"ACCRUAL"},{"action":{"type":"CAPITALISE_INTEREST"},"ruleId":"scheduled.capitalise","trigger":"CAPITALISATION"}]},"interest":{"accrualCadence":"DAILY","accrualRounding":"INTEREST_ACCRUAL","capitalisationCadence":"MONTHLY","dayCount":"ACT_365_FIXED","postingRounding":"LEDGER_POSTING","rate":"0.0300000000","rateType":"FIXED","ruleId":"interest.base"},"irVersion":1,"productCode":"SAVINGS-CZK"}
