{"currency":"EUR","fees":[{"accountingClass":"FEE_INCOME","amount":"4.9000","cadence":"MONTHLY","feeCode":"MAINT","ruleId":"fee.maintenance","waiver":{"attribute":"BALANCE","currency":"EUR","operator":"GTE","threshold":"1000.0000","type":"comparison"}}],"hooks":{"onClose":[{"action":{"templateId":"account-closed","type":"NOTIFY","variables":{"productCode":"CURRENT-ACCOUNT"}},"ruleId":"close.notify"}],"onOpen":[{"action":{"cadence":"MONTHLY","hook":"scheduled","tag":"FEE_MAINT","type":"SCHEDULE"},"ruleId":"open.schedule-fee"},{"action":{"templateId":"current-account-welcome","type":"NOTIFY","variables":{"productCode":"CURRENT-ACCOUNT"}},"ruleId":"open.welcome"}],"prePosting":[{"action":{"reasonCode":"OVERDRAFT_LIMIT_EXCEEDED","type":"REJECT"},"ruleId":"posting.overdraft-limit","when":{"attribute":"PROJECTED_BALANCE","operator":"LT","threshold":"-500.0000","type":"postingComparison"}}],"scheduled":[{"action":{"feeRuleId":"fee.maintenance","type":"CHARGE_FEE"},"ruleId":"scheduled.fee","trigger":"FEE_MAINT"}]},"irVersion":1,"productCode":"CURRENT-ACCOUNT"}
